{
  "contractVersion": "2026.08.0",
  "formatAliases": [],
  "formats": [
    {
      "code": "jpeg",
      "containerKind": "none",
      "defaultModality": "image",
      "extensions": [
        "jpg",
        "jpeg",
        "jfif"
      ],
      "formatFamily": "raster-image",
      "mimeHints": [
        "image/jpeg"
      ],
      "ruleIdPattern": "ext.image.{extension}.v1"
    },
    {
      "code": "raster-image",
      "containerKind": "none",
      "defaultModality": "image",
      "extensions": [
        "png",
        "gif",
        "bmp",
        "webp",
        "tif",
        "tiff",
        "ico",
        "apng"
      ],
      "formatFamily": "raster-image",
      "mimeHints": [
        "image/png",
        "image/gif",
        "image/bmp",
        "image/webp",
        "image/tiff"
      ],
      "ruleIdPattern": "ext.image.{extension}.v1"
    },
    {
      "code": "heif",
      "containerKind": "none",
      "defaultModality": "image",
      "extensions": [
        "heic",
        "heif",
        "avif"
      ],
      "formatFamily": "raster-image",
      "mimeHints": [
        "image/heic",
        "image/heif",
        "image/avif"
      ],
      "ruleIdPattern": "ext.image.{extension}.v1"
    },
    {
      "code": "svg",
      "containerKind": "none",
      "defaultModality": "image",
      "extensions": [
        "svg"
      ],
      "formatFamily": "vector-image",
      "mimeHints": [
        "image/svg+xml"
      ],
      "ruleIdPattern": "ext.image.{extension}.v1"
    },
    {
      "code": "camera-raw",
      "containerKind": "none",
      "defaultModality": "image",
      "extensions": [
        "cr2",
        "cr3",
        "nef",
        "arw",
        "dng",
        "orf",
        "rw2",
        "raf",
        "pef",
        "srw"
      ],
      "formatFamily": "raster-image",
      "mimeHints": [],
      "ruleIdPattern": "ext.image.{extension}.v1"
    },
    {
      "code": "raw-camera",
      "containerKind": "none",
      "defaultModality": "unknown",
      "extensions": [
        "raw"
      ],
      "formatFamily": "unknown",
      "mimeHints": [],
      "ruleIdPattern": "unknown.context-required.v1"
    },
    {
      "code": "audio",
      "containerKind": "none",
      "defaultModality": "audio",
      "extensions": [
        "mp3",
        "wav",
        "flac",
        "aac",
        "ogg",
        "m4a",
        "opus",
        "wma",
        "amr",
        "ape"
      ],
      "formatFamily": "audio",
      "mimeHints": [
        "audio/mpeg",
        "audio/wav",
        "audio/flac",
        "audio/aac",
        "audio/ogg",
        "audio/mp4",
        "audio/opus",
        "audio/x-ms-wma"
      ],
      "ruleIdPattern": "ext.audio.{extension}.v1"
    },
    {
      "code": "video",
      "containerKind": "none",
      "defaultModality": "video",
      "extensions": [
        "mp4",
        "avi",
        "webm",
        "mkv",
        "mov",
        "m4v",
        "flv",
        "wmv",
        "3gp",
        "mpg",
        "mpeg"
      ],
      "formatFamily": "video",
      "mimeHints": [
        "video/mp4",
        "video/x-msvideo",
        "video/webm",
        "video/x-matroska",
        "video/quicktime",
        "video/x-flv",
        "video/x-ms-wmv",
        "video/3gpp",
        "video/mpeg"
      ],
      "ruleIdPattern": "ext.video.{extension}.v1"
    },
    {
      "code": "mpeg-ts",
      "containerKind": "none",
      "defaultModality": "video",
      "extensions": [
        "ts",
        "mts"
      ],
      "formatFamily": "video",
      "mimeHints": [
        "video/mp2t"
      ],
      "ruleIdPattern": "ext.video.{extension}.v1"
    },
    {
      "code": "pcd",
      "containerKind": "none",
      "defaultModality": "point-cloud",
      "extensions": [
        "pcd"
      ],
      "formatFamily": "point-cloud",
      "mimeHints": [],
      "ruleIdPattern": "ext.point-cloud.{extension}.v1"
    },
    {
      "code": "pcd-bin",
      "containerKind": "none",
      "defaultModality": "point-cloud",
      "extensions": [
        "pcd.bin"
      ],
      "formatFamily": "point-cloud",
      "mimeHints": [],
      "ruleIdPattern": "ext.point-cloud.pcd-bin.v1"
    },
    {
      "code": "las",
      "containerKind": "none",
      "defaultModality": "point-cloud",
      "extensions": [
        "las",
        "laz"
      ],
      "formatFamily": "point-cloud",
      "mimeHints": [],
      "ruleIdPattern": "ext.point-cloud.{extension}.v1"
    },
    {
      "code": "ply",
      "containerKind": "none",
      "defaultModality": "point-cloud",
      "extensions": [
        "ply"
      ],
      "formatFamily": "point-cloud",
      "mimeHints": [],
      "ruleIdPattern": "ext.point-cloud.ply.context.v1"
    },
    {
      "code": "bin",
      "containerKind": "none",
      "defaultModality": "unknown",
      "extensions": [
        "bin"
      ],
      "formatFamily": "unknown",
      "mimeHints": [],
      "ruleIdPattern": "unknown.context-required.v1"
    },
    {
      "code": "unresolved-point-data",
      "containerKind": "none",
      "defaultModality": "unknown",
      "extensions": [
        "xyz",
        "pts",
        "e57"
      ],
      "formatFamily": "unknown",
      "mimeHints": [],
      "ruleIdPattern": "unknown.awaiting-golden.{extension}.v1"
    },
    {
      "code": "mesh-3d",
      "containerKind": "none",
      "defaultModality": "3d-model",
      "extensions": [
        "obj",
        "stl",
        "glb",
        "gltf",
        "fbx",
        "dae",
        "3ds",
        "usd",
        "usdz",
        "ifc",
        "blend",
        "lwo"
      ],
      "formatFamily": "mesh-3d",
      "mimeHints": [
        "model/obj",
        "model/stl",
        "model/gltf-binary"
      ],
      "ruleIdPattern": "ext.3d-model.{extension}.v1"
    },
    {
      "code": "cad-opaque",
      "containerKind": "none",
      "defaultModality": "unknown",
      "extensions": [
        "dwg",
        "dxf",
        "step",
        "stp",
        "iges",
        "igs"
      ],
      "formatFamily": "unknown",
      "mimeHints": [],
      "ruleIdPattern": "unknown.context-required.v1"
    },
    {
      "code": "nifti",
      "containerKind": "none",
      "defaultModality": "image",
      "extensions": [
        "nii",
        "nii.gz"
      ],
      "formatFamily": "medical-volume",
      "mimeHints": [
        "application/x-nifti"
      ],
      "ruleIds": {
        "nii": "ext.medical.nifti.v1",
        "nii.gz": "ext.medical.nifti-gzip.v1"
      }
    },
    {
      "code": "medical-volume",
      "containerKind": "none",
      "defaultModality": "image",
      "extensions": [
        "nrrd",
        "mha",
        "mhd",
        "mgh",
        "mgz"
      ],
      "formatFamily": "medical-volume",
      "mimeHints": [],
      "ruleIdPattern": "ext.medical.{extension}.v1"
    },
    {
      "code": "dicom",
      "containerKind": "none",
      "defaultModality": "image",
      "extensions": [
        "dcm",
        "dicom"
      ],
      "formatFamily": "medical-image",
      "mimeHints": [
        "application/dicom"
      ],
      "ruleIdPattern": "ext.image.{extension}.v1"
    },
    {
      "code": "pathology-slide",
      "containerKind": "directory-image",
      "defaultModality": "image",
      "extensions": [
        "svs",
        "ndpi",
        "mrxs",
        "scn",
        "bif",
        "vms",
        "vmu"
      ],
      "formatFamily": "medical-image",
      "mimeHints": [],
      "ruleIdPattern": "ext.medical.{extension}.v1"
    },
    {
      "code": "numeric-array",
      "containerKind": "none",
      "defaultModality": "unknown",
      "extensions": [
        "npy",
        "npz"
      ],
      "formatFamily": "numeric-array",
      "mimeHints": [],
      "ruleIdPattern": "unknown.context-required.v1"
    },
    {
      "code": "raw-pixel",
      "containerKind": "none",
      "defaultModality": "unknown",
      "extensions": [
        "yuv",
        "nv12"
      ],
      "formatFamily": "raw-pixel",
      "mimeHints": [],
      "ruleIdPattern": "unknown.context-required.v1"
    },
    {
      "code": "structured-json",
      "containerKind": "none",
      "defaultModality": "text",
      "extensions": [
        "json",
        "jsonl",
        "ndjson",
        "ipynb"
      ],
      "formatFamily": "structured-text",
      "mimeHints": [
        "application/json",
        "application/x-jsonlines",
        "application/x-ndjson"
      ],
      "ruleIdPattern": "ext.text.{extension}.v1"
    },
    {
      "code": "jsonl-gzip",
      "containerKind": "compression",
      "defaultModality": "text",
      "extensions": [
        "jsonl.gz"
      ],
      "formatFamily": "structured-text",
      "mimeHints": [
        "application/gzip"
      ],
      "ruleIdPattern": "ext.text.jsonl-gzip.v1"
    },
    {
      "code": "structured-markup",
      "containerKind": "none",
      "defaultModality": "text",
      "extensions": [
        "xml",
        "yaml",
        "yml",
        "toml"
      ],
      "formatFamily": "structured-text",
      "mimeHints": [
        "application/xml",
        "application/x-yaml",
        "application/toml"
      ],
      "ruleIdPattern": "ext.text.{extension}.v1"
    },
    {
      "code": "plain-text",
      "containerKind": "none",
      "defaultModality": "text",
      "extensions": [
        "txt",
        "md",
        "markdown",
        "html",
        "htm",
        "ini",
        "conf",
        "properties",
        "log",
        "py",
        "java",
        "go",
        "rs",
        "kt",
        "rb",
        "php",
        "swift",
        "c",
        "cpp",
        "h",
        "hpp",
        "cs",
        "css",
        "scss",
        "less",
        "js",
        "jsx",
        "tsx",
        "vue",
        "sh",
        "bash",
        "zsh",
        "sql",
        "dockerfile",
        "makefile"
      ],
      "formatFamily": "plain-text",
      "mimeHints": [